{
  "schema_version": "1.0",
  "slideId": "slide_03",
  "layoutId": "PROBLEM_SOLUTION_01",
  "sectionLabel": "SOLUTION",
  "title": "Remove repetitive checking without removing human control",
  "sourceChapterIds": ["2", "4"],
  "fieldProvenance": [
    { "path": "sectionLabel", "sourceChapterIds": ["4"] },
    { "path": "title", "sourceChapterIds": ["2", "4"] },
    { "path": "problem.title", "sourceChapterIds": ["2"] },
    { "path": "problem.description", "sourceChapterIds": ["2"] },
    { "path": "solution.title", "sourceChapterIds": ["4"] },
    { "path": "solution.description", "sourceChapterIds": ["4"] }
  ],
  "problem": {
    "title": "Manual matching slows the close",
    "description": "AP staff download invoices, correct extracted fields and compare each line against ERP records."
  },
  "solution": {
    "title": "Automate the confirmed standard case",
    "description": "The agent extracts fields, applies approved matching rules and routes every exception with evidence."
  }
}
